<?xml version="1.0" encoding="UTF-8"?>
<body xmlns="http://www.fittest.eu/itelog" xmlns:xsi="http://www.w3.org/2001/XMLSchema-instance"
	xsi:schemaLocation="http://www.fittest.eu/itelog itelog.xsd ">
	<E>
		<O ty="Struct">
			<fd n="action">
				<V ty="string" v="open"></V>
			</fd>
			<fd n="parameters">
				<O ty="Array">
					<fd n="url">
						<V ty="url" v="/~guitest/CuteNews/index.php"></V>
					</fd>
				</O>
			</fd>
		</O>
		<O ty="Struct">
			<fd n="action">
				<V ty="string" v="open"></V>
			</fd>
			<fd n="parameters">
				<O ty="Array">
					<fd n="url">
						<V ty="url" v="/~guitest/CuteNews/index.php"></V>
					</fd>
				</O>
			</fd>
		</O>
	</E>
	<E>
		<O ty="Struct">
			<fd n="action">
				<V ty="string" v="type"></V>
			</fd>
			<fd n="parameters">
				<O ty="Array">
					<fd n="xpath">
						<V ty="xpath" v="//input[1][@id='retype']"></V>
					</fd>
					<fd n="id">
						<V ty="ID" v="retype"></V>
					</fd>
					<fd n="text">
						<V ty="string" v="FittestFittest"></V>
					</fd>
				</O>
			</fd>
		</O>
	</E>
	
</body>
